{
  "$schema": "https://json-schema.org/draft/2020-12/schema",
  "$id": "https://agent-taskboard.local/schemas/wiki-document-companion.schema.json",
  "title": "Wiki Document Companion",
  "description": "Adjacent sidecar metadata for one Wiki document. The file lives next to the source document as <source-file>.meta.json and drives the document row metadata plus the generated companion HTML report.",
  "type": "object",
  "required": ["$schema", "schemaVersion", "title", "source", "report", "classification", "review", "drift", "findings"],
  "additionalProperties": false,
  "properties": {
    "$schema": {
      "type": "string",
      "const": "https://agent-taskboard.local/schemas/wiki-document-companion.schema.json"
    },
    "schemaVersion": {
      "type": "string",
      "const": "wiki-document-companion/v1"
    },
    "title": {
      "type": "string",
      "minLength": 1,
      "description": "Human label for the source document."
    },
    "source": {
      "type": "object",
      "required": ["path", "type", "fingerprint"],
      "additionalProperties": false,
      "properties": {
        "path": {
          "type": "string",
          "pattern": "^docs/.+",
          "description": "Repository-relative path of the document this companion describes."
        },
        "type": {
          "type": "string",
          "enum": ["markdown", "html", "json", "document"]
        },
        "fingerprint": { "$ref": "#/$defs/fingerprint" }
      }
    },
    "report": {
      "type": "object",
      "required": ["path", "generatedAt", "generator", "template"],
      "additionalProperties": false,
      "properties": {
        "path": {
          "type": "string",
          "pattern": "^docs/.+\\.report\\.html$",
          "description": "Repository-relative generated HTML report path. It should be adjacent to the source document."
        },
        "generatedAt": { "type": "string", "format": "date-time" },
        "generator": {
          "type": "string",
          "description": "Repository-relative generator script."
        },
        "template": { "type": "string" }
      }
    },
    "classification": {
      "type": "object",
      "required": ["owner", "documentMode", "temporalState", "implementationState"],
      "additionalProperties": false,
      "properties": {
        "owner": { "type": "string" },
        "documentMode": {
          "type": "string",
          "description": "Documentation, concept, vision, operational, or mixed document mode."
        },
        "temporalState": {
          "type": "string",
          "enum": ["present", "current", "future", "past", "mixed", "unknown"],
          "description": "Direction signal shown in the Wiki tree."
        },
        "implementationState": {
          "type": "string",
          "description": "Implemented, partial, planned, aspirational, or unknown implementation state."
        }
      }
    },
    "review": {
      "type": "object",
      "required": ["date", "method", "model", "sourceFingerprint", "sourceChangedSinceReview"],
      "additionalProperties": false,
      "properties": {
        "date": { "type": "string", "format": "date" },
        "method": { "type": "string" },
        "model": { "type": "string" },
        "sourceFingerprint": { "$ref": "#/$defs/fingerprint" },
        "sourceChangedSinceReview": {
          "type": "boolean",
          "description": "Stored generator verdict. The backend also recomputes the current source hash and can mark stale companions live."
        }
      }
    },
    "drift": {
      "type": "object",
      "required": ["grade", "hasDrift", "score", "summary", "rationale"],
      "additionalProperties": true,
      "properties": {
        "grade": { "type": "string", "enum": ["A", "B", "C", "D", "unknown"] },
        "hasDrift": { "type": ["boolean", "null"] },
        "score": { "type": ["number", "null"], "minimum": 0, "maximum": 1 },
        "summary": { "type": "string" },
        "rationale": {
          "type": "array",
          "items": { "type": "string" }
        }
      }
    },
    "axes": {
      "type": "object",
      "additionalProperties": { "type": "string" }
    },
    "duplicates": {
      "type": "object",
      "required": ["suspected", "groupSize", "similarTo"],
      "additionalProperties": false,
      "properties": {
        "suspected": { "type": "boolean" },
        "groupSize": { "type": "integer", "minimum": 1 },
        "similarTo": {
          "type": "array",
          "items": { "type": "string" }
        }
      }
    },
    "findings": {
      "type": "array",
      "description": "Structured explanation facts consumed by the generated HTML report.",
      "items": {
        "type": "object",
        "required": ["id", "severity", "axis", "summary"],
        "additionalProperties": false,
        "properties": {
          "id": { "type": "string" },
          "severity": { "type": "string", "enum": ["info", "warn", "error"] },
          "axis": { "type": "string" },
          "summary": { "type": "string" },
          "rationale": {
            "type": "array",
            "items": { "type": "string" }
          },
          "evidence": {
            "type": "array",
            "items": { "type": "string" }
          }
        }
      }
    },
    "nextAction": { "type": "string" }
  },
  "$defs": {
    "fingerprint": {
      "type": "object",
      "required": ["algorithm", "hash", "sizeBytes", "lineCount", "capturedAt"],
      "additionalProperties": false,
      "properties": {
        "algorithm": { "type": "string", "const": "sha256" },
        "hash": {
          "type": "string",
          "pattern": "^[a-f0-9]{64}$"
        },
        "sizeBytes": { "type": "integer", "minimum": 0 },
        "lineCount": { "type": "integer", "minimum": 0 },
        "capturedAt": { "type": "string", "format": "date-time" }
      }
    }
  }
}
