{
  "$schema": "https://agent-taskboard.local/schemas/wiki-document-companion.schema.json",
  "schemaVersion": "wiki-document-companion/v1",
  "title": "Progress lane writers metadata",
  "source": {
    "path": "docs/architecture/runner-lanes/progress-lane-writers.md",
    "type": "markdown",
    "fingerprint": {
      "algorithm": "sha256",
      "hash": "750276c433d8917bd9099c11a20bbcb98e1668ff36cccb39b7c779ab3567ec74",
      "sizeBytes": 8402,
      "lineCount": 132,
      "capturedAt": "2026-06-12T08:30:00Z"
    }
  },
  "report": {
    "path": "docs/architecture/runner-lanes/progress-lane-writers.md.report.html",
    "generatedAt": "2026-06-12T08:30:00Z",
    "generator": "scripts/wiki/generate-companion-metadata.mjs",
    "template": "wiki-document-companion-report/v1"
  },
  "classification": {
    "owner": "runner",
    "documentMode": "documentation",
    "temporalState": "present",
    "implementationState": "implemented"
  },
  "review": {
    "date": "2026-06-11",
    "method": "first-ten metadata scoring pass",
    "model": "codex",
    "sourceFingerprint": {
      "algorithm": "sha256",
      "hash": "750276c433d8917bd9099c11a20bbcb98e1668ff36cccb39b7c779ab3567ec74",
      "sizeBytes": 8402,
      "lineCount": 132,
      "capturedAt": "2026-06-12T08:30:00Z"
    },
    "sourceChangedSinceReview": false
  },
  "drift": {
    "grade": "B",
    "hasDrift": true,
    "score": 0.24,
    "summary": "The lane-writer concept remains current, with light drift risk from recent active-state and pipeline-display refinements.",
    "rationale": [
      "The document still explains progress-lane ownership.",
      "Recent UI state work changed how active processing is presented.",
      "It should reference current active-state semantics once settled."
    ]
  },
  "axes": {
    "architectureAlignment": "high",
    "implementationAlignment": "medium",
    "freshness": "medium",
    "operatorUsefulness": "high"
  },
  "duplicates": {
    "suspected": false,
    "groupSize": 1,
    "similarTo": []
  },
  "findings": [
    {
      "id": "drift-summary",
      "severity": "warn",
      "axis": "drift",
      "summary": "The lane-writer concept remains current, with light drift risk from recent active-state and pipeline-display refinements.",
      "rationale": [
        "The document still explains progress-lane ownership.",
        "Recent UI state work changed how active processing is presented.",
        "It should reference current active-state semantics once settled."
      ],
      "evidence": []
    },
    {
      "id": "drift-rationale-1",
      "severity": "warn",
      "axis": "drift",
      "summary": "The document still explains progress-lane ownership.",
      "rationale": [],
      "evidence": []
    },
    {
      "id": "drift-rationale-2",
      "severity": "warn",
      "axis": "drift",
      "summary": "Recent UI state work changed how active processing is presented.",
      "rationale": [],
      "evidence": []
    },
    {
      "id": "drift-rationale-3",
      "severity": "warn",
      "axis": "drift",
      "summary": "It should reference current active-state semantics once settled.",
      "rationale": [],
      "evidence": []
    }
  ],
  "nextAction": "Link to the current active-card and pipeline indicator behavior after the board slice is merged."
}
