{
  "$schema": "https://agent-taskboard.local/schemas/wiki-document-companion.schema.json",
  "schemaVersion": "wiki-document-companion/v1",
  "title": "Frontend design system metadata",
  "source": {
    "path": "docs/frontend/design-system.md",
    "type": "markdown",
    "fingerprint": {
      "algorithm": "sha256",
      "hash": "fd18b727c3ce4901d3d18777d6c73fa0bbb9e92eb5baed6da81e821440d4a105",
      "sizeBytes": 25048,
      "lineCount": 452,
      "capturedAt": "2026-06-12T08:30:00Z"
    }
  },
  "report": {
    "path": "docs/frontend/design-system.md.report.html",
    "generatedAt": "2026-06-12T08:30:00Z",
    "generator": "scripts/wiki/generate-companion-metadata.mjs",
    "template": "wiki-document-companion-report/v1"
  },
  "classification": {
    "owner": "frontend",
    "documentMode": "documentation",
    "temporalState": "mixed",
    "implementationState": "partially implemented"
  },
  "review": {
    "date": "2026-06-11",
    "method": "sample metadata pass",
    "model": "codex",
    "sourceFingerprint": {
      "algorithm": "sha256",
      "hash": "fd18b727c3ce4901d3d18777d6c73fa0bbb9e92eb5baed6da81e821440d4a105",
      "sizeBytes": 25048,
      "lineCount": 452,
      "capturedAt": "2026-06-12T08:30:00Z"
    },
    "sourceChangedSinceReview": false
  },
  "drift": {
    "grade": "C",
    "hasDrift": true,
    "score": 0.46,
    "summary": "The design direction is useful, but the app has moved quickly through Project Hub, board cards, and Wiki shell refinements.",
    "rationale": [
      "Shared sidebar components are now more important than the older page-level guidance suggests.",
      "Navigation persistence and splitters need to be part of the explicit design contract.",
      "The document should distinguish current implemented controls from desired patterns."
    ]
  },
  "axes": {
    "architectureAlignment": "medium",
    "implementationAlignment": "medium",
    "freshness": "low",
    "operatorUsefulness": "medium"
  },
  "duplicates": {
    "suspected": true,
    "groupSize": 3,
    "similarTo": [
      "docs/frontend/style-guide/README.md",
      "docs/frontend/style-guide/tabs.md"
    ]
  },
  "findings": [
    {
      "id": "drift-summary",
      "severity": "warn",
      "axis": "drift",
      "summary": "The design direction is useful, but the app has moved quickly through Project Hub, board cards, and Wiki shell refinements.",
      "rationale": [
        "Shared sidebar components are now more important than the older page-level guidance suggests.",
        "Navigation persistence and splitters need to be part of the explicit design contract.",
        "The document should distinguish current implemented controls from desired patterns."
      ],
      "evidence": []
    },
    {
      "id": "drift-rationale-1",
      "severity": "warn",
      "axis": "drift",
      "summary": "Shared sidebar components are now more important than the older page-level guidance suggests.",
      "rationale": [],
      "evidence": []
    },
    {
      "id": "drift-rationale-2",
      "severity": "warn",
      "axis": "drift",
      "summary": "Navigation persistence and splitters need to be part of the explicit design contract.",
      "rationale": [],
      "evidence": []
    },
    {
      "id": "drift-rationale-3",
      "severity": "warn",
      "axis": "drift",
      "summary": "The document should distinguish current implemented controls from desired patterns.",
      "rationale": [],
      "evidence": []
    },
    {
      "id": "duplicate-candidate",
      "severity": "warn",
      "axis": "duplicate",
      "summary": "This document has possible duplicate ownership candidates.",
      "rationale": [
        "docs/frontend/style-guide/README.md",
        "docs/frontend/style-guide/tabs.md"
      ],
      "evidence": []
    }
  ],
  "nextAction": "Add a current navigation and shell section that references the shared sidebar components."
}
